Вся правда о Soft skills,https://habr.com/ru/post/578588/
Устанавливаем Windows 7 на Macbook Air 2017,https://habr.com/ru/post/578582/
Краткая история паролей от античности до наших дней,https://habr.com/ru/company/selectel/blog/578578/
"React.js — 5 вещей, которые могут вас удивить",https://habr.com/ru/post/578444/
Как мы фронтиры науки с помощью тематического моделирования искали,https://habr.com/ru/company/sberbank/blog/575726/
Wargaming Platform глазами ньюкамера,https://habr.com/ru/company/wargaming/blog/578566/
"А есть ли оно, профессиональное выгорание",https://habr.com/ru/post/578576/
"Как я спас компанию, заставив играть коллектив в настольные игры",https://habr.com/ru/company/ruvds/blog/577820/
process mining: 100 строк кода и генератор логов у нас в руках,https://habr.com/ru/post/578570/
Предложение по электронным голосованиям,https://habr.com/ru/post/578564/
8 распространенных ошибок при разработке Android-приложений,https://habr.com/ru/company/otus/blog/578562/
ТОП-3 ИБ-событий недели по версии Jet CSIRT,https://habr.com/ru/company/jetinfosystems/blog/578560/
Топ-5 частых штрих-кодов в нашей жизни,https://habr.com/ru/post/578392/
Хакатон за месяц или практичные советы по организации хакатонов для новичков (от новичков),https://habr.com/ru/company/leroy_merlin/blog/578522/
Заглушить радар. С-75 – новая надежда,https://habr.com/ru/company/timeweb/blog/578544/
"Замена игрока, или Почему мы решили сменить Bug Bounty платформу?",https://habr.com/ru/company/timeweb/blog/578538/
С песней по жизни: эмбриональное обучение вокализации у птиц,https://habr.com/ru/company/ua-hosting/blog/578210/
Вечеропятничное моделирование: как плавает акула-собака,https://habr.com/ru/post/576598/
Построение библиотек компонентов и их организация. Или как извлечь максимальную пользу для бизнеса c React и Angular,https://habr.com/ru/company/europlan/blog/563464/
Вопросы на собеседовании безопасника,https://habr.com/ru/post/578452/
Как определить самый авторитетный фильм всех времен и народов,https://habr.com/ru/post/578526/
AWS Lambda с Java: быстро и недорого,https://habr.com/ru/post/578518/
Композиция > Наследование за 4 минуты,https://habr.com/ru/company/otus/blog/578516/
"Так ли полезен HSTS, как его малюют?",https://habr.com/ru/post/578510/
Снижение платежей за мощность с помощью накопителей энергии. Алгоритмы оценки и эффективная стоимость,https://habr.com/ru/post/578504/
Фреймворк для автоматизации – покупать или создавать?,https://habr.com/ru/company/otus/blog/578502/
Тестовое задание — крышка гроба или ступенька вверх по карьерной лестнице?,https://habr.com/ru/company/pixonic/blog/578500/
Какой софт использует ЦРУ и АНБ для дата-майнинга,https://habr.com/ru/company/itsumma/blog/578460/
Работа с СОМ-портом на Си в linux,https://habr.com/ru/company/ruvds/blog/578432/
"Docs-as-code: DevOps-технологии в документировании, или Как подружить технического писателя и разработчика",https://habr.com/ru/company/zyfra/blog/578486/
Как вырастить спикера на удалёнке,https://habr.com/ru/company/yoomoney/blog/578312/
История успеха: из джуна в сеньора за 2 года,https://habr.com/ru/company/e-Legion/blog/578488/
Как снизить стоимость владения электронным архивом в связке с SAP?,https://habr.com/ru/post/578484/
Интеграция устройства в экосистему Samsung SmartThings на примере «Умного чайника» Часть 2: переход с ESP8266 на ESP32,https://habr.com/ru/company/samsung/blog/578426/
Закорпоративь удаленщика. Вредные советы,https://habr.com/ru/company/maxilect/blog/578480/
TA505 нацелилась на розничную торговлю в США с помощью персонализированных вложений,https://habr.com/ru/company/otus/blog/578478/
Как прикрутить SQL к чему угодно при помощи Apache Calcite,https://habr.com/ru/company/oleg-bunin/blog/569254/
Проверь себя в Go,https://habr.com/ru/company/simbirsoft/blog/578208/
Практического повышения продуктивности пост,https://habr.com/ru/post/578464/
Сложить и расправить. Искусство оригами в робототехнике,https://habr.com/ru/post/578458/
Создаём инфраструктуру для интеграционных тестов: делаем образы и подводим итоги,https://habr.com/ru/company/2gis/blog/578404/
"Охота на орбитальные спутники: лазеры, роботизированные охотники и другие способы утилизации аппаратов",https://habr.com/ru/company/selectel/blog/578236/
Подробное описание операторов RxJS — Часть 1,https://habr.com/ru/post/578442/
"Загружаемые изображения для Jetpack Compose с использованием Glide, Coil и Fresco",https://habr.com/ru/company/otus/blog/578440/
Как я снял спутники Юпитера на ТЕЛЕФОН,https://habr.com/ru/post/578438/
Дизайнер-перфекционист: когда слишком хорошо — это плохо,https://habr.com/ru/post/578434/
"Возможности функций, возвращающих другие функции в JavaScript",https://habr.com/ru/company/otus/blog/578420/
Вся правда о когнитивных искажениях,https://habr.com/ru/post/578306/
MultiItem адаптер для RecyclerView в 40 строк кода с BRVAH,https://habr.com/ru/post/578416/
Обход блокировки РКН с помощью магии Service Worker'ов,https://habr.com/ru/post/578414/
Как мы обновляли мобильное приложение для официантов: выбор стека и тест трех версий. Кто победил?,https://habr.com/ru/company/r_k/blog/578386/
Советский СПОРТ,https://habr.com/ru/company/timeweb/blog/578398/
Российская конференция для разработчиков от Microsoft: Day of the DEVs,https://habr.com/ru/company/microsoft/blog/578396/
Архитектура как кот VS Архитектура как кол,https://habr.com/ru/company/rabota/blog/578340/
SSR для Bitrix с Vue.js без Nuxt.js: как не потерять поисковую индексацию,https://habr.com/ru/company/agima/blog/578056/
Даем почву для авто обнаружения пользователей Linux для Zabbix,https://habr.com/ru/post/578384/
Генераторы на корутинах C++,https://habr.com/ru/company/ispsystem/blog/578366/
Почему занавеска в душе хочет к вам прилипнуть,https://habr.com/ru/company/timeweb/blog/577452/
Первое знакомство с JavaScript-библиотекой Solid,https://habr.com/ru/company/ruvds/blog/576378/
Современная архитектура Electron приложений в 2021,https://habr.com/ru/post/578016/
Архитектор решения / инжиниринг,https://habr.com/ru/company/otus/blog/578372/
35 вопросов с собеседования JavaScript-разработчика,https://habr.com/ru/post/578370/
"Рутокен VPN в opensource – для кого, зачем и почему?",https://habr.com/ru/company/aktiv-company/blog/578362/
CI/CD для Dynamics CRM на базе Azure DevOps. Часть 2. Continuous Deployment,https://habr.com/ru/post/567110/
Запросы в PostgreSQL: 4. Индексное сканирование,https://habr.com/ru/company/postgrespro/blog/578196/
Файлы как они есть. Работа с типизированными массивами,https://habr.com/ru/company/raiffeisenbank/blog/578284/
"Разбираем мифы про беременность: анестезия, рентген и т.п",https://habr.com/ru/company/belayaraduga/blog/578278/
Книга «Эффективный C. Профессиональное программирование»,https://habr.com/ru/company/piter/blog/577854/
PlantUML — инструмент продуктового разработчика,https://habr.com/ru/company/qiwi/blog/577606/
Пересаживаем NXP-шный пример для Teensy 4.1 на язык C++,https://habr.com/ru/post/577914/
Митап SuperJob по фронтенду больших приложений,https://habr.com/ru/company/superjob/blog/578098/
"Involution: Attention is not what you need, или Как скрестить Self-Attention из NLP и Convolution в задачах CV",https://habr.com/ru/post/578308/
Насколько быстрее Java 17?,https://habr.com/ru/company/dcmiran/blog/578300/
От копии аркады 90-х на отдельном носителе до полноценной компьютерной игры со своим геймпадом,https://habr.com/ru/company/hsespb/blog/578276/
"iOS in-app purchases, часть 6: как реализовать скидки introductory offer, promotional offer, offer code",https://habr.com/ru/company/adapty/blog/578180/
Отображение объектов на картах в админке Django,https://habr.com/ru/post/578288/
"Сравнение инструментов для генерации thumbnails: imgproxy, thumbor, imaginary, picfit, imageproxy и weserv/images",https://habr.com/ru/post/578282/
Фотогалерея на максималках,https://habr.com/ru/post/578254/
Распознаем речь в Авроре,https://habr.com/ru/company/omprussia/blog/578250/
NFT-токены: новая валюта для спортивных фанатов?,https://habr.com/ru/company/ligastavok/blog/578270/
Энтерпрайзные проекты убили профессию разработчика,https://habr.com/ru/company/haulmont/blog/578260/
Шестой подвиг Геракла: как мы расчистили прод от багов,https://habr.com/ru/company/dins/blog/577996/
Earth Baku: как работают профессионалы кибершпионажа,https://habr.com/ru/company/trendmicro/blog/578258/
Когда Россия уйдет с МКС?,https://habr.com/ru/company/ruvds/blog/577182/
"Код ME310: Почему новый продукт для нас разрабатывают студенты МФТИ, Мюнстера и Стэнфорда?",https://habr.com/ru/post/578256/
Как я писал Биномиальную кучу,https://habr.com/ru/post/578252/
"Как автоматизировано защитить Mikrotik от несанкционированного доступа через API, порт 8728",https://habr.com/ru/post/578246/
Построение простого flow в IBM App Connect (Integration Bus),https://habr.com/ru/post/578234/
Рейкастинг в игровых 2D-движках,https://habr.com/ru/post/578110/
Сверну свой телек в трубочку,https://habr.com/ru/company/mvideo/blog/578228/
Восстановление удаленных строк в SQLite,https://habr.com/ru/post/575090/
Насколько быстры компьютеры,https://habr.com/ru/post/578232/
Экспресс-поддержка,https://habr.com/ru/company/X5Group/blog/578226/
Мифы современной Индии,https://habr.com/ru/post/578128/
Используйте фавиконки правильно,https://habr.com/ru/company/htmlacademy/blog/578224/
Чек-лист хороших инженерных практик в компаниях,https://habr.com/ru/company/hexlet/blog/578200/
Веб-безопасность 201,https://habr.com/ru/company/oleg-bunin/blog/570034/
Intel NUC X15 — NUC в виде ноутбука,https://habr.com/ru/company/intel/blog/577842/
Антисептик из сахара,https://habr.com/ru/post/577790/
Стипендия Chevening. Бесплатная магистратура в Великобритании (IT и не только),https://habr.com/ru/post/578218/
Как мы искали экспериментальный полигон для свежих идей и разработали новую торговую платформу,https://habr.com/ru/company/moex/blog/578156/
"Дедлайны горели, все фиксили в спешке, но клиент остался доволен. Как мы вывели сайт на 40 млн пользователей",https://habr.com/ru/company/nix/blog/576216/
Фискальный календарь Apple 2022: даты выплат и как они формируются,https://habr.com/ru/company/adapty/blog/578112/
Планируем и устанавливаем микросотовые DECT-системы Snom,https://habr.com/ru/company/snom/blog/578214/
Fluent setter. Нарушаем конвенцию,https://habr.com/ru/company/miro/blog/577478/
ТОП-5 вопросов менеджера про автоматизацию,https://habr.com/ru/company/hh/blog/577664/
Сколько на самом деле вакансий на Python в веб-разработке (на примере Москвы),https://habr.com/ru/post/578204/
Умный аналитик – глупый разработчик vs. глупый аналитик – умный разработчик,https://habr.com/ru/post/578202/
Как написать FizzBuzz на собеседовании,https://habr.com/ru/post/578198/
Нагрузочное тестирование сайта на Microsoft Azure,https://habr.com/ru/post/578192/
Реализуем рефлексию при помощи source generators,https://habr.com/ru/post/578190/
Цифровой юридический адрес,https://habr.com/ru/post/578188/
MATLAB + Git: как управлять изменениями скриптов и моделей Simulink без бардака и боли,https://habr.com/ru/company/etmc_exponenta/blog/578172/
MPIRE — быстрая альтернатива multiprocessing,https://habr.com/ru/company/skillfactory/blog/578014/
Менеджер вашей команды — роутер или модератор?,https://habr.com/ru/post/578168/
"Цены на редкоземельные металлы, дефицит чипов и торговые войны: стоимость гаджетов будет только расти",https://habr.com/ru/company/selectel/blog/577520/
Почти детективная история одной «кровавой» ошибки,https://habr.com/ru/company/timeweb/blog/578036/
Информационная безопасность и ДНК,https://habr.com/ru/company/timeweb/blog/575078/
18 сентября — One Day Offer для системных аналитиков,https://habr.com/ru/company/alfa/blog/578160/
Оптимизация ресурсов в Android. Ускорение сборки и уменьшение размера APK,https://habr.com/ru/post/578154/
Под капотом Ruby. GVL,https://habr.com/ru/post/577948/
Зачем Apple RISC-V?,https://habr.com/ru/company/timeweb/blog/578088/
"Чтобы избежать профессионального выгорания, нужно просто…",https://habr.com/ru/company/dododev/blog/577668/
48 полноценных бесплатных книг для программистов (happy developer's day),https://habr.com/ru/post/578122/
Mikrotik и VLAN,https://habr.com/ru/post/578126/
Пакетный обмен данными по UART,https://habr.com/ru/post/578116/
Игра с голосовым управлением на React и Phaser,https://habr.com/ru/company/kts/blog/578102/
Как часто вы меняете место работы?,https://habr.com/ru/post/578108/
Digital Material Passport. Ч.1 — Скрытые грани «цифровых двойников»,https://habr.com/ru/post/578104/
Большой тест ЗУ для автомобильных АКБ Victron Energy Blue Smart 12/15 с влагозащитой IP65. Часть 1: первое знакомство,https://habr.com/ru/company/ruvds/blog/575978/
Работа с GraphQL через Hasura для системных аналитиков и QA,https://habr.com/ru/company/accenture/blog/578060/
"Гибридная работа – это тяжело, но Microsoft Teams и Office 365 могут вам помочь",https://habr.com/ru/company/microsoft/blog/578096/
От неприятия к пониманию. Взгляд на стажировку в IT компании от лица HR,https://habr.com/ru/company/unidata/blog/578094/
Шесть стадий отрицания ретроспективы,https://habr.com/ru/company/quadcode/blog/578080/
Космический вызов: защита суперкомпьютеров от внеземной угрозы,https://habr.com/ru/company/cloud4y/blog/578028/
Изучаем МойОфис: как использовать макросы в редакторах документов и электронных таблиц,https://habr.com/ru/company/ncloudtech/blog/575336/
Мониторинг сервера Zimbra OSE с помощью Zabbix,https://habr.com/ru/company/zimbra/blog/577974/
«Вояджеры» и люди: судьба разработчиков,https://habr.com/ru/company/itelma/blog/578076/
Update Tuesday: Microsoft выпустила сентябрьские обновления безопасности,https://habr.com/ru/company/microsoft/blog/578074/
Как мы планируем работу над проектами в R&D,https://habr.com/ru/company/plarium/blog/578046/
Начало железнодорожного дела в России. Первый эксперимент в частно-государственном партнерстве,https://habr.com/ru/company/timeweb/blog/578072/
СЭД на платформе DocsVision (часть 2): как сократить базу данных с 19 до 11 ТБ,https://habr.com/ru/company/domrf/blog/578000/
"Higher-Kinded Data, или ещё один способ работать с сущностями базы данных (и не только)",https://habr.com/ru/post/578070/
Дата Кампус: можно ли освоить машинное обучение за 10 дней?,https://habr.com/ru/post/576978/
"Кто такие DevRel, зачем они нужны и какие вопросы могут решить для бизнеса",https://habr.com/ru/post/570594/
Делаем быстрый поиск по неточному совпадению среди 100 миллионов товаров,https://habr.com/ru/post/578068/
Акустическая обманка мотыльков: спастись ценою крыльев,https://habr.com/ru/company/ua-hosting/blog/577764/
Создание шутера с LeoECS. Часть 2,https://habr.com/ru/post/578054/
"Зачем айтишнику магистратура: мнения тех, кто поступил и не пожалел",https://habr.com/ru/company/netologyru/blog/577944/
Работаем с индексами при высокой нагрузке в rails с psql: как добавить/удалить индекс и при этом не умереть,https://habr.com/ru/company/karuna/blog/576016/
«Монитор госсайтов»: регионы просят ремня – 2021,https://habr.com/ru/post/578040/
"CO2: как получилось, что Россия всем должна, и чем тут поможет океан",https://habr.com/ru/company/leader-id/blog/578012/
"Как мы “повернули реки вспять” на Emergency DataHack 2021, объединив гидрологию и AutoML",https://habr.com/ru/post/577886/
"От разработки и дизайна до менеджмента и бизнеса — топовые спикеры, доклады и нетворкинг на юбилейном 404fest",https://habr.com/ru/company/404fest/blog/578032/
Обзор фреймворка cdk8s для «программирования» Kubernetes-манифестов,https://habr.com/ru/company/flant/blog/577624/
Мой MikroTik – моя цифровая крепость (часть 3),https://habr.com/ru/company/ruvds/blog/576284/
Добавляем интернационализацию в приложение на Next.js,https://habr.com/ru/company/alconost/blog/578024/
Kotlin Null-Safety vs ClassLoader,https://habr.com/ru/post/561962/
DevSecOps — когда «инфраструктура как код» встречается с «безопасностью как код»,https://habr.com/ru/company/otus/blog/578020/
Как я сделал «генератор дипломов для строительного вуза»,https://habr.com/ru/post/578008/
Про навигатор дополнительного образования,https://habr.com/ru/post/578004/
"Процессный подход, или В чем проблема выгорания на самом деле?",https://habr.com/ru/company/oleg-bunin/blog/552116/
Vivaldi 4.2 — Тонкости дословного перевода,https://habr.com/ru/company/vivaldi/blog/577988/
SDR трансивер Peaberry V2,https://habr.com/ru/company/timeweb/blog/577614/
Лето в Волхове,https://habr.com/ru/post/577976/
REALM — интеграция извлеченной информации в модели языковых представлений,https://habr.com/ru/post/577982/
Как я портировал DOS игру,https://habr.com/ru/post/571686/
Копируем файлы пачками в AWS S3,https://habr.com/ru/post/577970/
"Apple препятствовала разработчику обновлять приложение с клавиатурой для Apple Watch, а затем выпустила свою версию",https://habr.com/ru/post/577968/
Java от Oracle снова бесплатна,https://habr.com/ru/company/haulmont/blog/577966/
Беспроводной метеодатчик с дисплеем Explore Scientific ST1005,https://habr.com/ru/post/577960/
"Любопытные извращения из мира IT, или зачем мы JS в C++-код вкомпилили",https://habr.com/ru/post/577938/
PyFilesystem — мощная альтернатива pathlib,https://habr.com/ru/company/skillfactory/blog/577836/
СЭД на платформе DocsVision (часть 1): как группы доступности MSSQL помогают быстрее выкатывать изменения в прод,https://habr.com/ru/company/domrf/blog/577900/
"Apple Keynote 2021: четыре iPhone 13, клавиатура в Apple Watch и другие анонсы",https://habr.com/ru/company/pixonic/blog/577946/
Впечатления от Xbox 2s,https://habr.com/ru/post/577796/
"Скучно, просто и ограниченно — все это изотоническая регрессия",https://habr.com/ru/post/577942/
Батарейки GoPower,https://habr.com/ru/company/lamptest/blog/577814/
Точная сегментация лица в Keras и Python,https://habr.com/ru/post/577890/
"Дата-центры в царстве гномов: шахты, бункеры и подземелья, в которых построены современные ЦОД",https://habr.com/ru/company/selectel/blog/571898/
Apple Event. Текстовая трансляция (пост обновляется),https://habr.com/ru/post/577922/
С чего начать постройку дрона-дирижабля,https://habr.com/ru/post/577930/
Вышла Java 17,https://habr.com/ru/post/577924/
"Исторические чередования, или Почему в русском языке почти нет исключений",https://habr.com/ru/company/timeweb/blog/557572/
"Робо-пёс пока не кусается, но уже предупреждает о несанкционированном доступе в дата-центр",https://habr.com/ru/company/itsoft/blog/577918/
