Как коммуникации помогают в решении инцидентов,https://habr.com/ru/company/oleg-bunin/blog/571440/
Бессерверные БД: зачем переводить Stateful-сервис в Serverless,https://habr.com/ru/post/571206/
"Кодом и потом: 4 мифа о том, как становятся сеньорами",https://habr.com/ru/company/kolesa/blog/571498/
"Пример для подражания у японских школьников, или первые в мире кооперативы",https://habr.com/ru/company/timeweb/blog/571494/
Взять и заняться цифровой обработкой сигналов — какие библиотеки стоит попробовать в деле,https://habr.com/ru/company/audiomania/blog/571180/
Метод быстрого прохода в управлении проектами. Редкий успешный кейс,https://habr.com/ru/company/rshb/blog/571490/
КиберВойны ближайшего будущего и почему снова актуален тренд на теорию заговора,https://habr.com/ru/post/570542/
"Винт Серф и его межпланетный интернет: что это, как работает и для чего нужно",https://habr.com/ru/company/selectel/blog/570840/
"Строим аналитическое хранилище данных с готовыми модулями ML на Google BigQuery: просто, быстро, доступно",https://habr.com/ru/post/567078/
Вопросы на собеседовании для программистов компьютерной графики,https://habr.com/ru/company/gaijin/blog/569002/
Уязвимости в iOS,https://habr.com/ru/company/otus/blog/571462/
Как я запускал шаблонизатор офисных документов как сервис,https://habr.com/ru/post/571474/
JavaScript и SEO — Руководство по передовой практике,https://habr.com/ru/post/571470/
"GoLand 2021.2: Улучшенная поддержка Go-модулей, новые возможности запуска gofmt, поддержка Go 1.17",https://habr.com/ru/company/JetBrains/blog/571464/
Как подготовиться к сертификации AWS Certified Security – Specialty (SCS-C01),https://habr.com/ru/company/epam_systems/blog/571468/
Релокация в эпоху пандемии. Нужна ли она инженерам из России и СНГ?,https://habr.com/ru/company/exness/blog/571446/
GameDev: Империя Соблазна – Часть 1,https://habr.com/ru/post/571460/
"Дежавю: или кажется, программистов снова выставили на мороз",https://habr.com/ru/company/mvideo/blog/571458/
DataScience Digest — 05.08.21,https://habr.com/ru/post/571376/
Пару слов о Starship и Super Heavy от SpaceX,https://habr.com/ru/post/571456/
Что появится в специальных возможностях Windows 11,https://habr.com/ru/company/microsoft/blog/571444/
"Использование потоков WebAssembly из C, C++ и Rust",https://habr.com/ru/company/ruvds/blog/569578/
Как айтишнику издать свою книгу. Часть 3. Издательства: как попасть на полки книжных магазинов,https://habr.com/ru/post/571330/
Тролли против корейцев: московский суд запретил Samsung Pay (большой комментарий юриста),https://habr.com/ru/post/571430/
"Интеграция поисковой машины Яндекса с сайтом. Красивый дизайн, мощные алгоритмы и немного багов",https://habr.com/ru/post/571428/
Как выглядит стоматология будущего: зубы — это атавизм,https://habr.com/ru/company/belayaraduga/blog/571424/
Мой путь к кохлеарной имплантации,https://habr.com/ru/company/softline/blog/571422/
"Android in-app purchases, часть 2: инициализация и обработка покупок",https://habr.com/ru/company/adapty/blog/571122/
Кожа — наш персональный скафандр,https://habr.com/ru/company/geltek/blog/571392/
Где работать в ИТ в 2021: GigAnt,https://habr.com/ru/company/habr_career/blog/571410/
«Выручай-рейсы» в X5 Transport. Как мы сократили затраты на доставку путем автоматизации «пересменки» водителей,https://habr.com/ru/company/X5RetailGroup/blog/571412/
Авто-смыв унитаза для кота,https://habr.com/ru/post/571398/
Биопрепараты. Пробиотики и пребиотики. Что это такое и с чем едят?,https://habr.com/ru/post/571396/
Большой тест 6 автомобильных аккумуляторов иностранных брендов 2021. Часть 2: резервная ёмкость,https://habr.com/ru/company/ruvds/blog/568258/
"Тернистая история Лисп-машин: первый бум AI, война Столлмана и удивительный интерфейс",https://habr.com/ru/company/yandex/blog/519922/
Знакомимся с async/await в Swift,https://habr.com/ru/company/citymobil/blog/571360/
СВЧ разъёмы и тестовые платы,https://habr.com/ru/post/570662/
Рассказываем про апдейт платформы UiPath 21.4,https://habr.com/ru/company/uipath/blog/571372/
Применение машинного обучения для определения содержимого колонки в таблице,https://habr.com/ru/company/unidata/blog/571370/
Selectel File Storage Beta: места много не бывает,https://habr.com/ru/company/selectel/blog/571028/
Ускоряем код на Питоне с помощью расширений на Cи,https://habr.com/ru/company/alconost/blog/571366/
Анализ сборки с соединениями в SOLIDWORKS Simulation,https://habr.com/ru/company/ds/blog/570540/
Тестирование тестировщиков,https://habr.com/ru/company/hh/blog/571364/
Как кентавры обыгрывают ИИ: история про симбиоз компьютера и человека в логических играх,https://habr.com/ru/company/leader-id/blog/571246/
Kaspresso tutorials. Часть 1. Запуск первого теста,https://habr.com/ru/company/kaspersky/blog/570658/
"Когда используется Power Delivery, и что происходит при установлении соединения между блоком питания и устройством",https://habr.com/ru/company/sberdevices/blog/571362/
HashiСorp Vault & Kubernetes Secret: используем vault-secrets-operator,https://habr.com/ru/company/dataline/blog/571356/
Приглашаем компании к спонсорcтву PyCon Russia: прокачивайте HR-бренд вживую,https://habr.com/ru/company/it_people/blog/571166/
"Симуляция 4,5 миллиардов лет эволюции планеты на GPU",https://habr.com/ru/post/570976/
Intel меняет наименования техпроцессов,https://habr.com/ru/company/intel/blog/571020/
Проекторы от 5000 люмен: «перезапуск» серии популярных инсталляционных проекторов Epson серий Epson EB-L и Epson EB-PU,https://habr.com/ru/company/epson/blog/571084/
Спектральный анализ временных рядов с помощью python,https://habr.com/ru/post/571344/
История одного фееричного провала тестового задания на C#,https://habr.com/ru/post/571342/
Что не так с Asterisk Realtime и как с этим жить,https://habr.com/ru/post/571338/
9 советов по увеличению скорости Wi-Fi,https://habr.com/ru/company/itsoft/blog/571290/
Автоматическое построение карт для курьеров и логистов из 1C,https://habr.com/ru/post/571336/
Руководство Google по стилю в C++. Часть 3,https://habr.com/ru/post/571334/
Amundsen — обнаружение данных на основе механизма метаданных от Lyft,https://habr.com/ru/company/otus/blog/571298/
Сколько осталось местности вдали от людей?,https://habr.com/ru/post/571318/
Телескопы — кто они такие?,https://habr.com/ru/post/571320/
Удивительное растение — Аквилегия,https://habr.com/ru/post/571316/
Как структурировать крупномасштабное приложение Vue.js,https://habr.com/ru/company/otus/blog/571272/
Как я в 15 лет взломал хостинг,https://habr.com/ru/post/562018/
Настройка Kafka для работы в режиме подтверждения о принятии сообщения (ack/nack),https://habr.com/ru/post/571304/
Разбираемся с ChainMap из коллекций Python,https://habr.com/ru/company/skillfactory/blog/570590/
"Перейти на VueJS 3, Composition API и TypeScript?",https://habr.com/ru/post/571300/
Валидация моделей машинного обучения,https://habr.com/ru/company/glowbyte/blog/569970/
Ансамблевые методы машинного обучения,https://habr.com/ru/post/571296/
"Потратить время сейчас, чтобы сэкономить потом: как мы выстраивали процессы разработки и планирования на игровом проекте",https://habr.com/ru/company/lightmap/blog/571270/
Резервное копирование Звезды Смерти,https://habr.com/ru/company/cloud_mts/blog/571294/
"Удвоение частоты дискретизации оцифровкой в несколько проходов для правильно-периодических сигналов, возможно ли такое?",https://habr.com/ru/post/571292/
Формируем реляционную модель из schemaless базы данных MongoDB,https://habr.com/ru/company/otus/blog/571286/
Почему не зовут на собеседование Junior Web-разработчиков в Москве,https://habr.com/ru/post/571282/
«М.Каталог» — наш способ организации мастер-данных для всех категорий товаров,https://habr.com/ru/company/mvideo/blog/571216/
Мы взяли полку на петабайт — как у майнеров Chia — и протестировали ее,https://habr.com/ru/company/raidix/blog/571250/
"Скрытые мобильные подписки Tele2: разбираемся, как все устроено",https://habr.com/ru/post/571256/
JavaScript: как из Fetch сделать Axios?,https://habr.com/ru/company/timeweb/blog/571252/
Что такое Core Scheduling и кому он будет полезен?,https://habr.com/ru/company/ruvds/blog/569630/
CryptoMoonShots: как криптовалюты и реддит делают людей миллионерами,https://habr.com/ru/post/571248/
Использование типов TypeScript вместо Swagger,https://habr.com/ru/post/571240/
Accompanist — первый аккорд. Обзор библиотеки для Jetpack Compose,https://habr.com/ru/company/surfstudio/blog/570994/
"[Личный опыт] Жизнь и IT в Сеуле: почему жить тут хорошо, но очень непросто для иностранца",https://habr.com/ru/company/gms/blog/571234/
"Грешка, заблуда и буболечка, или как я погружалась в мобильное тестирование болгарского банка",https://habr.com/ru/post/571218/
Бесплатный вебинар: Основы ИИ (10 августа),https://habr.com/ru/company/microsoft/blog/571230/
"Webix UI и работа с формами. Пособие о том, как упростить жизнь разработчику",https://habr.com/ru/post/571200/
Анти-if: недостающие паттерны,https://habr.com/ru/company/otus/blog/571202/
Как собрать свой Lighthouse,https://habr.com/ru/company/oleg-bunin/blog/571114/
Как количественные исследования помогают создавать продукты МойОфис,https://habr.com/ru/company/ncloudtech/blog/568880/
Пища будущего: одноклеточный белок против сои,https://habr.com/ru/company/ua-hosting/blog/570990/
"О квантовых компьютерах, биткоине и превосходстве. Лекция открытого курса qmlcourse",https://habr.com/ru/company/ods/blog/571012/
Планируем развертывание Veeam Backup for Microsoft Office 365: советы экспертов,https://habr.com/ru/company/veeam/blog/571214/
"Чтобы улучшить Госуслуги, нужна простая советская…",https://habr.com/ru/company/rtlabs/blog/570930/
Как правильно сложить колоду автоматизации тестирования,https://habr.com/ru/company/otus/blog/571210/
О достижении целей,https://habr.com/ru/post/571198/
Почему тысячу лет назад вам было бы легче учить английский,https://habr.com/ru/post/571196/
"Как симулировать плохую сеть под Linux, macOS и Windows",https://habr.com/ru/company/itsumma/blog/571190/
ЦРУ против советских РЛС: как найти иголку в стоге сена с помощью Луны,https://habr.com/ru/company/timeweb/blog/571112/
Столпы Шрёдингера,https://habr.com/ru/post/571188/
Даешь давление для альпинистов или как дышать свободно на вершинах?,https://habr.com/ru/company/ruvds/blog/570760/
С галеры на верхнюю палубу: как и почему понимание языка заказчика влияет на доход разработчиков,https://habr.com/ru/company/oleg-bunin/blog/571174/
Kubernetes 1.22: обзор основных новшеств,https://habr.com/ru/company/flant/blog/571184/
Расширение синтаксиса Lua: лямбды,https://habr.com/ru/post/571182/
Статический анализ защищает ваш код от бомб замедленного действия,https://habr.com/ru/company/pvs-studio/blog/571178/
Как с помощью микросегментации сети обеспечить безопасность мультиоблачной инфраструктуры,https://habr.com/ru/company/step_logic/blog/571062/
"Незнакомцы в поезде, или Как мы вводили кросс-интервью при повышении грейда",https://habr.com/ru/company/reksoft/blog/571072/
Как настроить мониторинг событий в Kubernetes: 4 бесплатных инструмента,https://habr.com/ru/company/mailru/blog/570500/
Великий секвенатор: кто такие биоинформатики и что они изучают,https://habr.com/ru/company/redmadrobot/blog/571168/
Реализация счетчика наработки на микроконтроллере 1986BE92QI,https://habr.com/ru/post/571172/
Отказоустойчивое взаимодействие с внешними сервисами,https://habr.com/ru/company/ispring/blog/559416/
Как я не написал эксплоит,https://habr.com/ru/company/pm/blog/556088/
Мои экологические эксперименты. Начало,https://habr.com/ru/post/571120/
Управление кластерным хранилищем с помощью LINSTOR,https://habr.com/ru/company/fgts/blog/567162/
Vivaldi 4.1 для Android — Комфорт без посторонних,https://habr.com/ru/company/vivaldi/blog/571160/
Оставят ли сервисы по разработке софта на основе ИИ без работы программистов,https://habr.com/ru/post/571158/
"Из Compliance Assurance Manager в Software Engineer за полгода. Мои «набитые шишки» и советы, как не сдаться на полпути",https://habr.com/ru/company/epam_systems/blog/570982/
MongoDB — Захватывает мир. Семь способов резервного копирования и восстановления данных,https://habr.com/ru/post/571138/
"Как совместить поездку на конференцию и семейный отдых: 9 способов, которые есть на PyCon Russia",https://habr.com/ru/company/it_people/blog/571156/
"Обезьяна продает пасскоды, а постить с TOR все равно не дает",https://habr.com/ru/post/571148/
"Как стать пентестером, если ты ноль в IT – четыре истории из жизни «взломщицы человеческих голов»",https://habr.com/ru/company/searchinform/blog/571024/
Использование паттерна BFF для создания общих типов в бэкенде и фронтенде,https://habr.com/ru/company/itsoft/blog/571004/
"Почему важно понимать, как зарабатывает твоя компания",https://habr.com/ru/post/570834/
Как отбалансировать нагрузку существенного количества серверов — поможет новый алгоритм,https://habr.com/ru/company/vasexperts/blog/571086/
Мониторинг WebRTC стримов с помощью Prometheus и Grafana,https://habr.com/ru/company/flashphoner/blog/568784/
Миграция с Terraform на Terragrunt,https://habr.com/ru/company/southbridge/blog/570406/
Знать небо,https://habr.com/ru/post/571142/
"Бойтесь регистраторов, они могут разрушить бизнес. Или хотя бы попытаться",https://habr.com/ru/post/571140/
Разбираем обфусцированный CrackMe на C#,https://habr.com/ru/post/571134/
Microsoft Graph API Requests или иной способ управления M365,https://habr.com/ru/post/571132/
Firebase Test Lab. Авто-тесты без кода на физических устройствах,https://habr.com/ru/post/571130/
Креативные и эмоционально устойчивые: как игры делают нас лучше?,https://habr.com/ru/post/571128/
Используем Google Cloud AutoML Vision для создания бинарного классификатора для обнаружения пневмонии на рентгеновском,https://habr.com/ru/company/otus/blog/571076/
Лучшие RP2040 платы для ваших проектов в 2021 году,https://habr.com/ru/company/selectel/blog/570018/
Пришло время избавиться от Angular и сэкономить миллиарды долларов,https://habr.com/ru/company/ruvds/blog/569536/
Как сделать магический шар на Three.js,https://habr.com/ru/company/skillfactory/blog/570592/
"Недельный геймдев: #29 — 1 августа, 2021",https://habr.com/ru/post/571108/
"История жестких дисков, часть I",https://habr.com/ru/company/seagate/blog/571106/
"Отойти от IT: куда расти, когда код ради кода больше не интересен",https://habr.com/ru/company/jugru/blog/560280/
Июль. Орбитальные запуски,https://habr.com/ru/post/571092/
Тонкости левел-дизайна: как не «убить» свободу выбора игрока,https://habr.com/ru/company/playgendary/blog/571008/
Магия создания процессоров: травление и осаждение. Разбор,https://habr.com/ru/company/droider/blog/568780/
"Начинал строить дома, построил карьеру в IT",https://habr.com/ru/company/kolesa/blog/571074/
При создании DevSecOps не забывайте о SRE,https://habr.com/ru/company/otus/blog/571070/
Исследуем обнаруженные зловреды группы APT31: что нового,https://habr.com/ru/company/pt/blog/571068/
NEST-NEXT: Best Practices — Часть 2,https://habr.com/ru/post/571032/
Установка WSL с помощью одной команды стала доступна в Windows 10,https://habr.com/ru/company/microsoft/blog/571066/
Новое слово в VDI ,https://habr.com/ru/company/dell_technologies/blog/571018/
О ходе создания игры «Колобок» в июле,https://habr.com/ru/post/571056/
Полиномиальная регрессия и метрики качества модели,https://habr.com/ru/post/571058/
Еще один сайт для изучения слов. Зачем?,https://habr.com/ru/post/570504/
Всё о работе с cookie в Python — класс http.cookies,https://habr.com/ru/company/timeweb/blog/564620/
Гайд по использованию enum в Python,https://habr.com/ru/company/timeweb/blog/564826/
Зачем студентам теория графов,https://habr.com/ru/post/570970/
"Словарь визуальных слов: как создать, зачем использовать, где применять",https://habr.com/ru/company/abbyy/blog/571054/
Угрозы промышленной автоматизации: новые и незабытые старые,https://habr.com/ru/company/trendmicro/blog/571050/
Зачем мне твой код смотреть?,https://habr.com/ru/post/571048/
Почему у нас такое жёсткое лицензионное соглашение,https://habr.com/ru/company/ruvds/blog/571010/
Отказоустойчивость бесперебойных систем модульной архитектуры: «CENTIEL» и «EATON»,https://habr.com/ru/post/571030/
Greybox-фаззинг: level up. Как улучшали фаззеры,https://habr.com/ru/company/bizone/blog/570534/
Do IT like a Russian: чем крупный ритейл может удивить технического директора,https://habr.com/ru/company/magnit/blog/570992/
Из кузова грузовика в сумочку: самые известные портативные компьютеры,https://habr.com/ru/company/cloud4y/blog/571014/
Как создать бота ВКонтакте: гайд для старта на платформе,https://habr.com/ru/company/vk/blog/570486/
Flutter + Socket.io — Обмен информацией в режиме реального времени,https://habr.com/ru/company/rshb/blog/568356/
Nginx. Фазы обработки запроса. If is Evil?,https://habr.com/ru/post/570996/
Анализ теста по Go с PHDays,https://habr.com/ru/post/571002/
Приёмы ускорения кода на JS и других языках: подборка от разработчика поиска Яндекса,https://habr.com/ru/company/yandex/blog/570914/
Будущее Web это HTML через WebSockets,https://habr.com/ru/post/570522/
Marshmallow vs. Pydantic: две лучшие библиотеки для сериализации и валидации данных на Python,https://habr.com/ru/company/domclick/blog/570802/
BDD-тестирование чат-бота,https://habr.com/ru/company/oleg-bunin/blog/551430/
"Структурная нота: кому — вершки, а кому — корешки?",https://habr.com/ru/post/570900/
Как называть функции во фронтенде,https://habr.com/ru/post/570960/
“Падение” не черного Фантома или как еще один проект DARPA так не увидел космос,https://habr.com/ru/company/itsoft/blog/570998/
Стройка в минус 40 и шесть модулей по 15 тонн: как устроен дата-центр в Магнитогорске,https://habr.com/ru/company/croc/blog/569356/
"Киберпанк, который мы заслужили, или как Prisma превращает ваши селфи в произведение искусства",https://habr.com/ru/company/prisma/blog/559028/
Обзор обнаруженных техник и тактик группировки Winnti. Часть 1,https://habr.com/ru/company/lanit/blog/570516/
Архитектура «Р7-Офис»: почему сам редактор и интерфейсы надо обязательно разносить?,https://habr.com/ru/company/r7-office/blog/570216/
Контейнер LXC для веб-разработки как альтернатива Docker,https://habr.com/ru/post/563040/
