"Как сделать так, чтобы в России появлялись частные прорывные разработки в области авиации и космоса",https://habr.com/ru/post/584466/
Стильный инструмент: обзор ноутбука IBM ThinkPad T30,https://habr.com/ru/company/selectel/blog/583644/
"Прикладная некромантия. Перенос почтового сервера, не обновлявшегося пятнадцать лет, на iRedMail",https://habr.com/ru/company/first/blog/582416/
Внутреннее устройство Kubernetes-кластера простым языком,https://habr.com/ru/company/flant/blog/583660/
ZFS таинственным образом поедает мой CPU,https://habr.com/ru/company/dcmiran/blog/584458/
"Как мы смогли обзвонить 1,5 млн абонентов за несколько часов",https://habr.com/ru/company/neuronet/blog/584302/
Новая Яндекс.Станция Мини. Большая история маленького устройства,https://habr.com/ru/company/yandex/blog/584214/
"Психология, литература и материнство — чем еще занимаются сотрудники Техцентра?",https://habr.com/ru/company/dbtc/blog/584082/
Адаптация Qt-приложений под мониторы высокой чёткости. Часть 1,https://habr.com/ru/post/582180/
MoscowJS 50 — как это было,https://habr.com/ru/company/moscowjs/blog/582012/
Выпуск Rust 1.56.0 и 2021 редакция,https://habr.com/ru/post/585052/
"«Это что! А вот у меня на собесе было…», или Байки с технических интервью",https://habr.com/ru/company/jugru/blog/585042/
Игра по правилам Event loop в Node.js,https://habr.com/ru/company/lineate/blog/585050/
Боремся за тестируемость: избавляемся от антипаттернов с помощью диалога,https://habr.com/ru/company/otus/blog/585046/
Сохранение пакетов Perl через local,https://habr.com/ru/post/585038/
"Топ-5 слов с немецким происхождением, которые широко используются в английском",https://habr.com/ru/company/englishdom/blog/584946/
Работа с проблемными *.dwg-файлами в среде nanoCAD версия 2.0,https://habr.com/ru/company/nanosoft/blog/580180/
Реализация кластеризации методом k-средних на Python (с визуализацией),https://habr.com/ru/post/585034/
OWASP Top Ten и Software Composition Analysis (SCA),https://habr.com/ru/company/pvs-studio/blog/585030/
"Сдохни, кодовое слово, сдохни",https://habr.com/ru/post/585024/
Пять распространенных проблем кандидатов (по результатам 600 технических собеседований),https://habr.com/ru/company/geekfactor/blog/585022/
Различные виды тетрисов и где они обитают,https://habr.com/ru/company/timeweb/blog/557376/
Жёсткий матрас: Ретро видеокарты Matrox Millenium G550 и P650 в играх,https://habr.com/ru/post/583104/
Как мы Neo4j к Helidon прикручивали,https://habr.com/ru/post/584796/
Зарплаты в Python за последние 10 лет,https://habr.com/ru/company/skillfactory/blog/584810/
О пушках Гаусса и не только,https://habr.com/ru/company/ruvds/blog/583914/
Зачем мониторить трафик локальной сети?,https://habr.com/ru/company/dsol/blog/585014/
Идём по графику: предсказанный 50 лет назад коллапс человечества пока никто не отменил,https://habr.com/ru/post/585012/
Германия: руководство пользователя,https://habr.com/ru/post/581512/
Моя жена умирала от рака мозга. Мой босс в Amazon сказал мне вернуться к работе или уволиться,https://habr.com/ru/post/585010/
Идеальный код: битва при Sonar,https://habr.com/ru/company/parallels/blog/584998/
ТОП-3 ИБ-событий недели по версии Jet CSIRT,https://habr.com/ru/company/jetinfosystems/blog/585002/
Цифровизация в металлургии: ЕВРАЗ проводит хакатон по Data Science,https://habr.com/ru/company/evraz/blog/584902/
Доступность в Angular c помощью CDK A11y на реальных кейсах с FocusTrap и FocusMonitor,https://habr.com/ru/company/europlan/blog/578856/
Карта процессов верхнего уровня компании и матрица RACI c помощью drawio и google sheets,https://habr.com/ru/post/584984/
12 шагов героя-продакта. Как становятся продактом и к чему быть готовым на этом пути,https://habr.com/ru/company/sberbank/blog/584982/
Оружие для Луны: из чего астронавты собирались стрелять в космонавтов,https://habr.com/ru/company/first/blog/582392/
Отправка и прием данных неизвестной длины по UART через DMA в freeRTOS на STM32 с использованием LL,https://habr.com/ru/post/584866/
История Saudi Aramco. Так пишется история,https://habr.com/ru/post/584166/
Компания Facebook заставила разработчика удалить расширение для чистки новостной ленты под угрозой суда,https://habr.com/ru/company/productivity_inside/blog/584972/
Собеседование на позицию Data Engineer в X5: чего ждать и как лучше подготовиться (часть 2),https://habr.com/ru/company/X5Group/blog/584966/
Вот как Амазон измеряет свою эффективность,https://habr.com/ru/post/584918/
Работа с ML Kit в Android: как распознавать штрихкоды,https://habr.com/ru/company/simbirsoft/blog/584888/
Data Science с нуля. Большая подборка курсов,https://habr.com/ru/post/584964/
Как стать web-разработчиком на Python за полгода: конкретный план действий,https://habr.com/ru/company/pvs-studio/blog/584962/
Kubernetes Nginx Ingress: Перенаправление трафика с использованием аннотаций,https://habr.com/ru/post/584958/
Можно ли найти работу в IT после 40 лет,https://habr.com/ru/company/yandex_praktikum/blog/584806/
"Что движет человечеством: как люди построили цивилизацию, чтобы освободиться от естественного отбора",https://habr.com/ru/company/ruvds/blog/580956/
Локализация и мультиязычность во Flutter,https://habr.com/ru/company/alconost/blog/584942/
Acronis #CyberFit Summit — ключевые спикеры,https://habr.com/ru/company/acronis/blog/584938/
A-B тесты в рассылках (и не только): когда зафиксированные улучшения ведут к ухудшению,https://habr.com/ru/company/superjob/blog/584936/
Движок VSO: Под капотом нашего редактора,https://habr.com/ru/company/playrix/blog/584804/
Экстренная миграция «РУСХИМСЕТЬ»,https://habr.com/ru/company/cloud_mts/blog/584880/
Админка на Google Sheets — быстрый запуск и минимум ресурсов,https://habr.com/ru/company/skyeng/blog/584472/
Рейтинг лучших электромобилей 2021 года по версии издания «Популярная Механика»,https://habr.com/ru/company/itsoft/blog/584932/
Одна задача с собеса,https://habr.com/ru/post/584924/
Определение App flavors для приложений Flutter,https://habr.com/ru/company/talenttech/blog/584788/
Практика в Снежинске,https://habr.com/ru/post/584914/
Docker: по ту сторону Hello World,https://habr.com/ru/post/584820/
Улучшения в эмуляторе Dolphin,https://habr.com/ru/post/581406/
Детектив данных,https://habr.com/ru/post/584904/
"Мой код понятен, но это не точно",https://habr.com/ru/company/piter/blog/584606/
React: разрабатываем хук для загрузки дополнительных данных,https://habr.com/ru/company/timeweb/blog/584862/
"Олимпиады, стажировки и преподавание. Интервью с Егором Суворовым",https://habr.com/ru/company/JetBrains-education/blog/584822/
Генерация признаков из временных рядов,https://habr.com/ru/post/584896/
"Как обновить 3,5 тыс. криптошлюзов «Континент» и не сойти с ума – грабли и способы обхода",https://habr.com/ru/company/solarsecurity/blog/584816/
Полярная звезда,https://habr.com/ru/post/584882/
Самодельный стратостат. Часть 3,https://habr.com/ru/post/584398/
Внутри русского процессора Байкал М,https://habr.com/ru/post/584868/
XP-PEN Artist 22E Pro — запоздалая рецензия на графический дисплей,https://habr.com/ru/post/584856/
История управления торговлей государством,https://habr.com/ru/company/timeweb/blog/584854/
Физик и ролики,https://habr.com/ru/post/584848/
Уроки по SDL 2: Урок 15 Многопоточность и Тиллинг,https://habr.com/ru/post/584846/
Особенности потребления аудиоконтента онлайн (опыт аудиосервиса СберЗвук),https://habr.com/ru/post/584840/
25 ноября в Москве Видео+Конференция 2021,https://habr.com/ru/company/trueconf/blog/584632/
telebot(pyTelegramBotAPI) 2 часть,https://habr.com/ru/post/581018/
Маркетинговая рассылка: согласие или легитимный интерес?,https://habr.com/ru/post/585126/
Новые музыкальные инструменты — кто их делает и кто на них играет,https://habr.com/ru/company/audiomania/blog/585110/
Советы по работе с Quarkus,https://habr.com/ru/post/585122/
Записки авиационного метролога. Военный аэродром в Гудаута. Путешествие по черноморским курортам,https://habr.com/ru/post/585120/
Самый полный чек-лист для защиты от мошенников,https://habr.com/ru/post/585118/
Смарт-часы Samsung Galaxy Watch 4: обзор после полутора месяцев использования,https://habr.com/ru/post/585116/
"Что там в «Мире Hi-Fi»: ЯП и библиотеки для работы со звуком, ресурсы с «открытой» музыкой, стандарты и критика",https://habr.com/ru/company/audiomania/blog/585100/
"Уходящий поезд российской демократии, и что с этим делать",https://habr.com/ru/post/585106/
Он вам не слепень,https://habr.com/ru/company/timeweb/blog/585104/
Внедрение ЕRP: боли и желания заказчика на пути к полной автоматизации,https://habr.com/ru/post/585102/
Простой шутер от третьего лица на Unreal Engine. Часть 2,https://habr.com/ru/company/otus/blog/585090/
"MirrorBlast. Гляжусь в тебя, как в зеркало…",https://habr.com/ru/post/585096/
Терминаторы в деле: автономные боевые роботы пришли на поля сражений,https://habr.com/ru/company/ruvds/blog/585016/
Настоящий компьютер в Майнкрафте,https://habr.com/ru/post/585088/
"Век живи — век учись, а вперед middle не лезь… Как получить оффер и отказаться от него",https://habr.com/ru/post/585084/
Записки авиационного метролога. Военный аэродром в Копитнари. История моего «полёта»,https://habr.com/ru/post/585078/
Маленькие «малинки» в крупном дата-центре (часть 2 — iPXE + Buildroot),https://habr.com/ru/company/selectel/blog/582576/
[Личный опыт] Взгляд изнутри: японец о работе в саппорте и сфере IT в Азии и Европе,https://habr.com/ru/company/gms/blog/585072/
Создаем облако на Elixir,https://habr.com/ru/post/584986/
"Введение в Облачные Вычисления для Всех от Инженера Microsoft, Ex-Amazon",https://habr.com/ru/post/585064/
Три проигрывателя винила для домашней системы — подборка примечательных моделей в диапазоне 60-70 тысяч рублей,https://habr.com/ru/company/audiomania/blog/584410/
Кризис в электронике приводит к удорожанию DDR5 — дешевой память не будет,https://habr.com/ru/company/selectel/blog/584450/
Создание шутера с LeoECS. Часть 3,https://habr.com/ru/post/585058/
"Основы партнерской программы «Форсайт+», или как BI-вендору создать эффективную систему взаимоотношений с IT-компаниями",https://habr.com/ru/company/fsight/blog/585054/
"Возможно, худшая лампочка в мире",https://habr.com/ru/company/lamptest/blog/584970/
Первые семестры в KAUST как CEMSE/CS PhD student,https://habr.com/ru/post/584974/
Технологии виртуальной и дополненной реальности в уголовной системе,https://habr.com/ru/post/582558/
Подсчет автомобильного трафика с использованием COMPUTER VISION4,https://habr.com/ru/post/585248/
Рецепты PostgreSQL: виджет Государственного Адресного Реестра,https://habr.com/ru/post/585244/
Закрученные электроны как портал в квантовый мир,https://habr.com/ru/post/575434/
"«Мотивировать vs Вдохновлять. Инсайты о том, как раскрыть таланты в команде с пользой для всех»: интервью с самим собой",https://habr.com/ru/post/585224/
История фотовспышки (статья плюс видео),https://habr.com/ru/post/585242/
Новые ИИ-системы понимают язык жестов и позволяют общаться со слабослышащими или глухими людьми,https://habr.com/ru/company/neuronet/blog/585240/
[Mikrotik] Шаманизм в RouterOS или как я сделал нормально закрытый Firewall в RAW,https://habr.com/ru/post/585238/
Применяем Hooks из React во Flutter,https://habr.com/ru/post/585166/
И еще немного рассуждений про необходимость всеобщего отказа от мяса и молочных продуктов ради спасения планеты…,https://habr.com/ru/post/585194/
"Беспилотные судна покоряют океан, а также о технологии новейших парусов от Michelin",https://habr.com/ru/post/582642/
Дайджест свежих материалов из мира фронтенда за последнюю неделю №490 (18 — 24 октября 2021),https://habr.com/ru/post/585234/
Пишем систему рекомендаций музыки на основе ML,https://habr.com/ru/company/skillfactory/blog/585182/
Получаем кривую плотности распределения вероятности случайного (или нет) процесса,https://habr.com/ru/post/585232/
Создаем начальную миграцию с alembic для существующей базы,https://habr.com/ru/post/585228/
FOSS News №93 — дайджест материалов о свободном и открытом ПО за 18—24 октября 2021 года,https://habr.com/ru/post/585226/
Neovim для full stack программиста,https://habr.com/ru/post/585222/
"История о том, как я за минуту разработал приёмопередающую систему для МинПромстроя, сэкономив миллионы советских рублей",https://habr.com/ru/post/585220/
А твой Exchange в полном порядке? Как бесплатно мониторить здоровье сервера,https://habr.com/ru/post/585218/
14 450 пасхалок,https://habr.com/ru/company/timeweb/blog/550480/
Citymobil Data Meetup №3,https://habr.com/ru/company/citymobil/blog/585214/
Мобильный подавитель микрофонов на Arduino. Принцип работы,https://habr.com/ru/company/globalsign/blog/585212/
Дайджест интересных материалов для мобильного разработчика #416 (18 — 24 октября),https://habr.com/ru/company/productivity_inside/blog/585208/
Из Java в Kotlin: туда и обратно,https://habr.com/ru/post/583850/
Есть ли дебетовые карты с реально бесплатным обслуживанием?,https://habr.com/ru/post/585206/
Паттерны в проектировании пользовательского опыта,https://habr.com/ru/post/585198/
Тестирование проброса GPU на AMD Ryzen 7 5700G APU,https://habr.com/ru/company/ruvds/blog/583784/
"Сказка о поломке или что делать, когда проблема не понятна",https://habr.com/ru/post/585192/
Готовим Json в Apache NiFi или снова Jolt Transform,https://habr.com/ru/post/585184/
"Крупнейший радиотелескоп современности FAST: история создания, новые открытия и поиск внеземного разума",https://habr.com/ru/company/selectel/blog/584060/
Разработка приложений с Windows Subsystem for Android,https://habr.com/ru/post/585178/
5++ способов в одну строку на Python решить первую задачу Проекта Эйлера,https://habr.com/ru/post/585176/
"Ведьминская кривая Аньези, форму которой имеет рампа единственного российского авианосца. Почему она так названа?",https://habr.com/ru/post/585174/
Документируй или столкнись с хаосом: как мы создали базу знаний в стартапе,https://habr.com/ru/company/gigant/blog/585108/
Почему видеоигры — это хорошие учителя?,https://habr.com/ru/company/ruvds/blog/582482/
8 проблем в архитектуре Kubernetes,https://habr.com/ru/post/585164/
Провинциальный взгляд на аттестацию государевых информационных систем,https://habr.com/ru/company/niisokb/blog/585018/
Chorda 3.0. Осенний релиз,https://habr.com/ru/post/585112/
"Есть ли жизнь после FAANG компании или мой опыт собеседований в Северной Америке, 20+ компаний за 3 недели",https://habr.com/ru/post/585144/
История крови. Самая древняя проблема обратной совместимости,https://habr.com/ru/post/585148/
Flare-On 8 2021 CTF writeup'ы,https://habr.com/ru/post/584672/
Игра в бисер на Python,https://habr.com/ru/post/585142/
"Барахолки в Испании: iPod, Google Home mini, PSP и кое-что еще",https://habr.com/ru/company/selectel/blog/564878/
Подготовка эффективной среды для написания bash сценариев,https://habr.com/ru/post/583320/
Практическое применение сервера FreeACS для обслуживания устройств Mikrotik по протоколу TR-069 (часть 1),https://habr.com/ru/post/584894/
Цифровое моделирование аналоговых гитарных эффектов дисторшн,https://habr.com/ru/post/585136/
Postgresso 35 — спецвыпуск: PostgreSQL 14,https://habr.com/ru/company/postgrespro/blog/581552/
Бадминтонный трекер BTracker,https://habr.com/ru/post/585134/
Почему технические собеседования не нужны,https://habr.com/ru/post/585132/
Взламываем воронку найма видео резюме,https://habr.com/ru/post/585474/
Публикация Android библиотеки,https://habr.com/ru/post/585472/
"Новые мини-ПК, на которые стоит обратить внимание: от ASUS c Intel Jasper Lake до EliteMini HM90 с Ryzen 9 4900H",https://habr.com/ru/company/selectel/blog/585204/
"Недельный геймдев: #41 — 24 октября, 2021",https://habr.com/ru/post/585468/
Настройка VSCode для программирования stm32 в Linux и не только в Linux,https://habr.com/ru/post/585464/
Ноев ковчег — история становления зоологии,https://habr.com/ru/post/585454/
Подключение телеграм бота к гугл таблицам,https://habr.com/ru/post/585456/
"Случай в больнице, или история о том, как я ракетоносцам СССР «глаза открывал.» Часть1",https://habr.com/ru/post/585452/
"Наблюдение за Дистанционным Электронным Голосованием 2021 года (система Waves-РосТелеКом, федеральная)",https://habr.com/ru/post/585448/
Одержимость контролируемыми входными метриками,https://habr.com/ru/post/585442/
Как устроен back-end в быстрорастущей edtech-компании,https://habr.com/ru/post/585440/
"Возможно, в мозге найден эквивалент обратного распространения",https://habr.com/ru/company/skillfactory/blog/585286/
U-boot. Процедура инициализации по шагам,https://habr.com/ru/post/585432/
О чем расскажут на С++ Russia 2021,https://habr.com/ru/company/jugru/blog/583476/
Публикация Spring Boot приложения в GitHub Packages с помощью GitHub Actions для самых маленьких,https://habr.com/ru/post/576412/
Доллары в глазах: сравниваем российские и американские зарплаты,https://habr.com/ru/company/getmeit/blog/585398/
Тимлиды и разработчики: как программисты ищут работу в 2021 году,https://habr.com/ru/post/585400/
Security Week 43: функциональность трояна Trickbot,https://habr.com/ru/company/kaspersky/blog/585394/
Изоляция CSS в Razor Pages,https://habr.com/ru/company/otus/blog/585390/
Нейросети в борьбе с идиотизмом заградительных мер в политике,https://habr.com/ru/post/585386/
Техническая экспертиза: настраиваем CI на М1 с командой Welps,https://habr.com/ru/company/selectel/blog/585384/
Корутины в C++20 — что это и как с ними работать,https://habr.com/ru/company/wunderfund/blog/582000/
"Настройка системы для облачного гейминга с помощью VFIO, Parsec и AMD",https://habr.com/ru/company/ruvds/blog/584910/
Свой стартап внутри компании,https://habr.com/ru/company/deutschetelekomitsolutions/blog/585356/
7 платформ для подготовки к техническому интервью на английском языке,https://habr.com/ru/company/geekfactor/blog/585352/
Танцы без бубнов или как я реализовал автомат на ПЛИС,https://habr.com/ru/company/etmc_exponenta/blog/585342/
Будущее SD-WAN: от MPLS к Autonomous Driving Network,https://habr.com/ru/company/huawei/blog/585340/
Сравнительная статистика уровня жизни графических дизайнеров в 6-ти странах мира,https://habr.com/ru/post/585338/
Тимлид в 20 или 50 оттенков выгорания,https://habr.com/ru/post/585336/
