Update Tuesday: Microsoft выпустила августовские обновления безопасности,https://habr.com/ru/company/microsoft/blog/572600/
iOS in-app purchases: серверная валидация покупок,https://habr.com/ru/company/adapty/blog/572370/
Как продавать партиями на AliExpress,https://habr.com/ru/post/572598/
DataScience Digest — 12.08.21,https://habr.com/ru/post/572592/
Обзор DDoS-атак за первый квартал 2021 года,https://habr.com/ru/post/572590/
Закон о «Дия.City» подписан. Что дальше? Официальное заявление IT Guild Ukraine,https://habr.com/ru/post/572586/
3D-реконструкция и нейронные аватары: 3D компьютерное зрение на CVPR 2021,https://habr.com/ru/company/twin3d/blog/572576/
Kotlin + Hibernate: всё сложно,https://habr.com/ru/company/haulmont/blog/572574/
Мысли про книгу Джордана Питерсона «Beyond Order: 12 More Rules for Life,https://habr.com/ru/post/572572/
"Про очень терпеливую девушку, которой хотели удалить 6 зубов",https://habr.com/ru/company/belayaraduga/blog/572566/
"[Личный опыт] Один разработчик и три страны: сравниваем Израиль, Нидерланды и Англию",https://habr.com/ru/company/gms/blog/572570/
4 способа разочаровать работодателя своими познаниями в DevOps-е,https://habr.com/ru/company/otus/blog/572562/
ИННОВАЦИИ VS/В КОРПОРАЦИИ,https://habr.com/ru/post/572564/
Хватит тратить моё время! Почему простой клиент хочет CRM,https://habr.com/ru/company/regionsoft/blog/572550/
Использование диаграммы классов при проектировании и документировании программного обеспечения,https://habr.com/ru/post/572234/
“Тайный клуб системной аналитики” или путь к идеалу,https://habr.com/ru/company/otkritie/blog/572558/
Переходим на HTTPS за 15 минут на примере TeamCity,https://habr.com/ru/company/visiology/blog/571324/
Compliance-дайджест: изменения законодательства в области ИБ за июль 2021 года,https://habr.com/ru/company/solarsecurity/blog/572396/
"5 стандартных Linux-команд, которые сильно упрощают жизнь, запускаем виртуальную Linux-машину в Podman…",https://habr.com/ru/company/redhatrussia/blog/572556/
Из техлида в менеджеры продукта: чем поможет бэкграунд разработки и стоит ли переходить именно вам,https://habr.com/ru/company/oleg-bunin/blog/572346/
Новые возможности зонтичной AIOps системы мониторинга Monq,https://habr.com/ru/company/galssoftware/blog/572552/
Исповедь джуна. Как начать карьеру в IT,https://habr.com/ru/post/572548/
Не «Оперой» единой. Выбираем proxy-сервис вместо Opera VPN,https://habr.com/ru/company/timeweb/blog/572108/
"Подходим к любительскому астрофото с научной стороны. Часть вторая, статистическая",https://habr.com/ru/post/572486/
BlackBerry. Статья обо всём,https://habr.com/ru/post/572520/
Buy reddit upvotes или что такое FoMO на финансовых рынках,https://habr.com/ru/post/572544/
Ruby Interview Questions,https://habr.com/ru/post/572542/
Коварные болезни: легионеллёз,https://habr.com/ru/company/timeweb/blog/572538/
Dependency Injection в React — максимально просто,https://habr.com/ru/post/572536/
Как поднять российскую «Науку»,https://habr.com/ru/company/ruvds/blog/571760/
"Правила жизни дата-центра в дождь, шторм и аномальную жару",https://habr.com/ru/company/dataline/blog/572524/
Выходим из тюрьмы Apple. Установка произвольных приложений на iOS без джейлбрейка,https://habr.com/ru/company/itsumma/blog/570874/
"Как найти и выбрать разработчика сайта для малого бизнеса, если у вас совсем небольшой бюджет?",https://habr.com/ru/post/572532/
"Как мы запилили первую стажировку в QA, и что из этого вышло",https://habr.com/ru/company/rvision/blog/572376/
"Хватит клепать псевдопрограммистов, или «Горшочек — не в IT!»",https://habr.com/ru/company/domclick/blog/572272/
Кто такой дизайнер и зачем ему UX: большое исследование Нетологии о рынке и трендах,https://habr.com/ru/company/netologyru/blog/572016/
IntelliJ IDEA Changelists и Git Staging,https://habr.com/ru/post/568608/
Reactive Data Display Manager. История одного рефакторинга,https://habr.com/ru/company/surfstudio/blog/572380/
"Модули, монолиты и микросервисы",https://habr.com/ru/company/flant/blog/572414/
Инструменты для проверки доступности веб-страниц. Полное руководство,https://habr.com/ru/company/htmlacademy/blog/572502/
Nivelir: Удобный DSL для навигации,https://habr.com/ru/company/hh/blog/572488/
Необычные примеры SMA-разъёмов,https://habr.com/ru/post/572452/
Парсинг Instagram в промышленных масштабах,https://habr.com/ru/post/571846/
Технология BLOCKCHAIN в ипотеке (часть 1),https://habr.com/ru/company/domrf/blog/572350/
Nginx. О чем не хотелось писать,https://habr.com/ru/post/572324/
Анализ аудио. Идентификация голоса,https://habr.com/ru/post/572496/
История проблемы равенства классов P и NP,https://habr.com/ru/company/timeweb/blog/572468/
#BHUSA 2021: участники делятся впечатлениями от первого лица,https://habr.com/ru/company/acronis/blog/572448/
Intel NUC 11 Extreme — микро-ПК на стероидах,https://habr.com/ru/company/intel/blog/572098/
Моя эпопея настройки автодеплоя: ошибки и открытия,https://habr.com/ru/post/572492/
Немного о вариабельности SARS-CoV-2 (ч.I),https://habr.com/ru/post/572490/
Zero Code — неизбежность,https://habr.com/ru/post/572480/
"Всегда есть тот, кто предложит больше денег. Иллюзия выбора?",https://habr.com/ru/post/572466/
Дар Прометея — античная медицина,https://habr.com/ru/post/572438/
Положение по аттестации ФСТЭК России,https://habr.com/ru/post/572462/
Учебник по Solidity. Все об адресах,https://habr.com/ru/post/572456/
Ключ от старости. Детская прогерия и луч надежды,https://habr.com/ru/post/572454/
Super Duper Secure Mode,https://habr.com/ru/post/572258/
Как написать квестовую RPG,https://habr.com/ru/company/playgendary/blog/572138/
Превращаем уборку в хобби: премиальные роботы-пылесосы 2021 года,https://habr.com/ru/company/mvideo/blog/572426/
Расширение языка программирования (C++/Planning C). Волшебные сканеры и компилирующие макросы,https://habr.com/ru/post/572416/
"JPEG, который можно посмотреть в блокноте",https://habr.com/ru/post/572352/
Гибридный офис в NAUMEN. От идеи до реализации,https://habr.com/ru/company/naumen/blog/572348/
АйТи Гильдия Украины. Что это и зачем нужно,https://habr.com/ru/post/571814/
Бурлаки деплоя. Или автоматизация проверок финтех-систем,https://habr.com/ru/company/oleg-bunin/blog/572406/
Как за неделю до релиза переобуться и сократить размер билда в 3 раза,https://habr.com/ru/company/pixonic/blog/572730/
Apache Ozone и узлы хранения данных высокой плотности,https://habr.com/ru/company/cloudera/blog/571546/
"Как приручить дракона или Сказочка о том, как разработчик впервые встретился с Unit-тестами",https://habr.com/ru/company/rostelecom/blog/572640/
Большая Карамельная Ракета,https://habr.com/ru/post/571968/
"Не обижайте котиков и собачек, а ищите их среди… питонов",https://habr.com/ru/post/572716/
Установка и настройка L2TP на настольных телефонах SNOM,https://habr.com/ru/company/snom/blog/572712/
Методы машинного обучения теперь и при интеграции информационных систем,https://habr.com/ru/company/bashnipineft/blog/572710/
Ансамбль слоистых сред,https://habr.com/ru/post/572018/
"UUID версии 7, или как не потеряться во времени при создании идентификатора",https://habr.com/ru/post/572700/
Автоматический контроль качества документации в Asciidoc или DocOps для Хабра,https://habr.com/ru/post/571326/
Генераторы литературного контента на рынке финансовой информации,https://habr.com/ru/post/572696/
Общий обзор Power Platform,https://habr.com/ru/post/572694/
Какие статьи мы пишем и читаем: научпоп vs науч без “попы” vs инженерные vs переводы vs реклама,https://habr.com/ru/post/572686/
Телеграм-бот криптовалютного кошелька на основе  php-telegram-bot,https://habr.com/ru/post/572692/
Загадка волшебного SSD: почему системный накопитель PlayStation 5 настолько быстр?,https://habr.com/ru/company/wd/blog/572674/
Программирование DeFi: Uniswap. Часть 3,https://habr.com/ru/post/572682/
Видите глаза? А их нет,https://habr.com/ru/post/572680/
"История компании Avast: с 1988 года по наши дни. Кто основал, почему и что произошло потом",https://habr.com/ru/company/selectel/blog/572294/
Как тестировщики написали свою мобильную ферму для IOS,https://habr.com/ru/post/572668/
Как приложения для точного земледелия помогают фермерам бороться с глобальным потеплением,https://habr.com/ru/post/572666/
Как закалялась документация,https://habr.com/ru/company/unidata/blog/572664/
Генератор факельного разряда на MOSFET-транзисторе,https://habr.com/ru/post/572660/
Трансформатор тока для детектирования включений нагрузки в сети 220В,https://habr.com/ru/post/572400/
Какая документация нужна вашему проекту и кто должен её писать,https://habr.com/ru/company/ozontech/blog/572652/
Виртуальные государства или осознанный выбор сообщества для жизни. Княжество Силэнд,https://habr.com/ru/post/572032/
Реализация сервера авторизации OAuth с помощью сервера авторизации Spring,https://habr.com/ru/company/otus/blog/572606/
Как выглядит эффект бэггинга на смещение и дисперсию,https://habr.com/ru/company/skillfactory/blog/570572/
"Как самому сделать видео для сайта или для рекламы, чтобы не было стыдно за результат: пошаговая инструкция (часть 1)",https://habr.com/ru/post/572656/
Управление бесколлекторными двигателями из Astra Linux,https://habr.com/ru/post/572654/
"Утилитарные цифровые права, цифровые активы и цифровая валюта. Разбираемся, что есть что по российскому закону",https://habr.com/ru/company/timeweb/blog/572642/
Простейший способ создания музыкальной гармонии. Квинтовый круг с числами мажорности аккордов,https://habr.com/ru/post/572644/
RHVoice Lab: как работают незрячие энтузиасты проекта по созданию голосов для синтезаторов речи,https://habr.com/ru/company/selectel/blog/572620/
Инновации VS/В корпорации,https://habr.com/ru/post/572564/
Использование диаграммы классов UML при проектировании и документировании программного обеспечения,https://habr.com/ru/post/572234/
Руководство по инструментам доступности,https://habr.com/ru/company/htmlacademy/blog/572502/
Немного о вариабельности SARS-CoV-2,https://habr.com/ru/post/572490/
Создание указателей в C#,https://habr.com/ru/post/573054/
Есть тело — есть дело,https://habr.com/ru/post/573052/
Node.js кросс-доменная инъекция Cookie,https://habr.com/ru/post/573046/
"Две главы новой книги инженера Android, или Как Google покупала Android",https://habr.com/ru/company/skillfactory/blog/573004/
О выгорании в СССР из книжки 1973 года,https://habr.com/ru/post/573022/
ФИАС с человеческим лицом,https://habr.com/ru/post/573036/
Повышение скорости написания кода: Emmet и его использование в VSCode,https://habr.com/ru/post/573032/
Как энтузиасты программы на BASIC с помощью радио передавали,https://habr.com/ru/company/audiomania/blog/572982/
Создание шутера с LeoECS. Часть 1,https://habr.com/ru/post/573028/
Поиск адресов в «испорченных» данных,https://habr.com/ru/post/573018/
Ассоциативная самозамкнутая сеть. Как смотреть на примитивы и базу данных,https://habr.com/ru/post/573020/
Прошивка Wi-Fi-модуля Realtek и разработка Intel 8051-кейлоггера с применением технологии RealWoW,https://habr.com/ru/company/ruvds/blog/570746/
Правильное TDD,https://habr.com/ru/post/573016/
Дайджест интересных материалов для мобильного разработчика #406 (9 — 15 августа),https://habr.com/ru/company/productivity_inside/blog/573014/
"Владивосток, оползни и логистическая регрессия",https://habr.com/ru/post/573012/
"Планета X. Поиски, разочарования, надежды",https://habr.com/ru/post/573008/
Идеи из стола: о борьбе с COVID-19 или встречный пал (отжиг),https://habr.com/ru/post/573002/
Сниппет-менеджер и генератор кода в одном флаконе,https://habr.com/ru/post/572996/
Как и зачем выстраивать коммуникации с пользователями,https://habr.com/ru/company/oleg-bunin/blog/572820/
Повторил заставку «Что было дальше?» за 24 часа,https://habr.com/ru/post/572990/
Использование Amiga в 2021: создание интро для демопати,https://habr.com/ru/company/ruvds/blog/572074/
Создание .exe установщика для UWP приложения,https://habr.com/ru/post/572988/
Автомобиль-русофоб,https://habr.com/ru/post/572984/
Динамическая JIT компиляция С/С++ в LLVM с помощью Clang,https://habr.com/ru/company/timeweb/blog/572878/
Изоляция модели предметной области,https://habr.com/ru/post/572744/
Google не хватает химиков и школьников? (положительно/отрицательная рецензия с предложениями),https://habr.com/ru/post/572972/
Распространение консольных приложений macOS до конечных пользователей,https://habr.com/ru/post/572970/
Генерация документации с использованием JSDoc,https://habr.com/ru/post/572968/
Почему у нас до сих пор нет роботов-каменщиков?,https://habr.com/ru/post/572966/
Как выглядят два не совсем обычных проигрывателя винила до 30 тысяч рублей от Pro-Ject и Rega,https://habr.com/ru/company/audiomania/blog/572930/
Записки владельца электромобиля «поневоле»,https://habr.com/ru/post/572964/
Искусственный интеллект как инструмент для создания процессоров: Samsung показывает пример,https://habr.com/ru/company/selectel/blog/572762/
От веб-студии к SaaS сервису для автоматизации склада (часть первая),https://habr.com/ru/post/572960/
CodeIgniter 4: Подготовка к PHPUnit. Устанавливаем Xdebug в XAMPP (Windows 32-разрядная (x86)),https://habr.com/ru/post/572402/
Какие открытые проекты развивает наша лаборатория мультиагентных систем в умных городах и Индустрии 4.0,https://habr.com/ru/company/spbifmo/blog/572186/
"Искусственный интеллект в разработке: как используют сейчас, что его ждет в будущем и боятся ли ИИ программисты",https://habr.com/ru/company/gms/blog/572954/
«От недр своя…» — история медицины Древней и Средневековой Руси,https://habr.com/ru/post/572946/
Как превратить книгу о Гарри Поттере в граф знаний,https://habr.com/ru/company/skillfactory/blog/570582/
Передовые технологии на службе СЭД,https://habr.com/ru/post/572952/
"SSE, нотификации, Node.js и при чём тут C#?",https://habr.com/ru/post/572948/
31 июля 1981 года. Полное солнечное затмение,https://habr.com/ru/post/572944/
Заглянем в будущее Python,https://habr.com/ru/company/oleg-bunin/blog/572748/
Cross-Fold Generation или как генерировать длинные последовательности с ruGPT-3,https://habr.com/ru/post/572940/
Как уронить космическую станцию,https://habr.com/ru/post/572924/
Отечественный DSP процессор 1967ВН028 от фирмы Milandr. Небольшой мануал по арифметике на языке assembler,https://habr.com/ru/post/572934/
HighFleet: игра про битвы небесных кораблей,https://habr.com/ru/company/ruvds/blog/572912/
Как делают опросы в письмах — практические примеры и советы,https://habr.com/ru/post/572812/
А «убивают» ли на самом деле русский Intel?,https://habr.com/ru/post/572922/
"Register-based calling convention, GO?",https://habr.com/ru/post/571420/
Memo в React,https://habr.com/ru/post/572920/
"Опыт Xsolla: форма ужасна, содержание верное",https://habr.com/ru/company/oleg-bunin/blog/569252/
Как защищены финансы на бирже и как выбрать надежного брокера,https://habr.com/ru/post/572910/
Часы на основе индикатора ИЛЦ3-5/7 (ILC3-5/7),https://habr.com/ru/post/572908/
Как в Datalake объединить слишком большое количество небольших файлов в несколько больших с помощью Apache Spark,https://habr.com/ru/company/otus/blog/572522/
Попробовать себя в проектировании интерфейсов для DAW-плагинов — помогут эти инструменты,https://habr.com/ru/company/audiomania/blog/572856/
"Generic Math: суперфича C#, доступная в .NET 6 Preview 7",https://habr.com/ru/post/572902/
Учебник по Solidity. Всё про библиотеки,https://habr.com/ru/post/572894/
Проект электронного мультитула QUARK. Часть 3,https://habr.com/ru/post/572892/
Эпизод кибератаки на МИД РФ в 2014 году,https://habr.com/ru/post/572890/
"Право на ремонт все ближе к потребителю: США, Европа, РФ, далее — везде",https://habr.com/ru/company/selectel/blog/571892/
RT сегодня,https://habr.com/ru/post/572874/
Кухонный компьютер Honeywell,https://habr.com/ru/company/otus/blog/572870/
Поднимаем кластер Hadoop с помощью Ansible,https://habr.com/ru/company/otus/blog/572850/
SQL на стероидах – 5 кейсов использования dbt + Jinja,https://habr.com/ru/company/otus/blog/572816/
6 рекомендаций по определению метода __init__,https://habr.com/ru/company/otus/blog/572868/
Ассоциативная самозамкнутая сеть. Что нужно для создания сильного ИИ,https://habr.com/ru/post/572866/
Метакласс — школа от KTS,https://habr.com/ru/company/kts/blog/572862/
Интерполяция — мать анимации — Твинеры в Unity,https://habr.com/ru/post/572860/
Allure. В поисках почти идеальной TMS,https://habr.com/ru/post/571476/
Использование SET STATISTICS TIME ON в SQL Server,https://habr.com/ru/company/otus/blog/572854/
Понять кубик Рубика,https://habr.com/ru/post/572852/
Blitz Excel UI,https://habr.com/ru/post/572848/
"CХД для видеонаблюдения: будь проще, и деньги потянутся",https://habr.com/ru/company/raidix/blog/572824/
Взрывной элемент Agile,https://habr.com/ru/post/572840/
Карьера программиста не заканчивается в 35,https://habr.com/ru/company/skillfactory/blog/570584/
Как мы автоматизировали процесс генерации Release Notes,https://habr.com/ru/company/ru_mts/blog/572774/
WireGuard для подключения к домашней Raspberry pi и использование домашнего интернета удалённо,https://habr.com/ru/post/572796/
"Хьюстон, что-то опять пошло не так?",https://habr.com/ru/company/ruvds/blog/572784/
ІТ-термины на примере процесса выращивания картошки. Часть вторая,https://habr.com/ru/post/572832/
Возможна ли анонимная оплата в Apple Pay?,https://habr.com/ru/company/postuf/blog/572834/
"Production Ready: 4 вопроса, которые важно задать перед созданием чек-листа",https://habr.com/ru/company/otus/blog/572822/
"Всё о проекте «Спутниковый интернет». Часть 34. SpaceX планирует купить компанию SWARM, чтобы выйти на рынок IoT",https://habr.com/ru/post/572800/
Киберпреступность: последствия для бизнеса,https://habr.com/ru/post/572808/
ТОП-3 ИБ-событий недели по версии Jet CSIRT,https://habr.com/ru/company/jetinfosystems/blog/572806/
PostgreSQL 15: Часть 1 или Коммитфест 2021-07,https://habr.com/ru/company/postgrespro/blog/572782/
19 августа — митап QIWI Android Developer Days,https://habr.com/ru/company/qiwi/blog/572804/
30 лет ИТ: глазами «олдскулов» и «джунов»,https://habr.com/ru/company/mvideo/blog/572802/
Сладкая смерть: открытие нового вида плотоядного растения,https://habr.com/ru/company/ua-hosting/blog/572510/
